{"_type":"https://in-toto.io/Statement/v1","predicate":{"assessments":[{"change_id":"github:acme/api:pr:421","reason":"A different human approved the current head before merge, with no later withdrawal recorded.","rule_id":"ACC001","status":"pass"},{"change_id":"github:acme/api:pr:421","reason":"No self-approval was observed in complete review data.","rule_id":"ACC002","status":"pass"},{"change_id":"github:acme/api:pr:421","reason":"A different human approved the current head before merge, with no later withdrawal recorded.","rule_id":"ACC003","status":"pass"},{"change_id":"github:acme/api:pr:421","reason":"A human agent operator is recorded.","rule_id":"ACC006","status":"pass"},{"change_id":"github:acme/api:pr:421","reason":"No agent reviewed the current head.","rule_id":"ACC007","status":"not_applicable"},{"change_id":"github:acme/api:pr:421","reason":"A human approved the current head.","rule_id":"ACC008","status":"not_applicable"},{"change_id":"github:acme/api:pr:421","reason":"Agent approvals do not satisfy independence under this policy.","rule_id":"ACC009","status":"not_applicable"},{"change_id":"github:acme/api:pr:421","reason":"Agent approvals do not satisfy independence under this policy.","rule_id":"ACC010","status":"not_applicable"},{"change_id":"github:acme/api:pr:421","reason":"No reviewer team is required for this change's tier.","rule_id":"ACC011","status":"not_applicable"}],"events":{"actors":{"agent:claude-code":{"display_name":"Claude Code","kind":"agent","vendor":"anthropic"},"agent:codex":{"display_name":"Codex","kind":"agent","vendor":"openai"},"github:alice":{"display_name":"Alice","kind":"human","vendor":null},"github:bob":{"display_name":"Bob","kind":"human","vendor":null},"github:ci":{"display_name":"CI","kind":"bot","vendor":null}},"attestations":{},"changes":[{"agent_operator":{"actor_id":"github:alice","confidence":"explicit","provenance":[{"kind":"declared","ref":"https://github.com/acme/api/pull/421","source":"pr_metadata"}]},"author":{"actor_id":"agent:claude-code","provenance":[{"kind":"observed","ref":"https://api.github.com/repos/acme/api/pulls/421","source":"github_api"}]},"commits":[{"author":{"actor_id":"github:alice","provenance":[{"kind":"observed","ref":"https://api.github.com/repos/acme/api/pulls/421","source":"github_api"}]},"sha":"head"}],"forge":"github","forge_author":{"actor_id":"github:alice","provenance":[{"kind":"observed","ref":"https://api.github.com/repos/acme/api/pulls/421","source":"github_api"}]},"head_sha":"head","id":"github:acme/api:pr:421","labels":[],"merge_commit_sha":"merge","merged_at":"2026-08-03T12:00:00Z","merger":{"actor_id":"github:alice","provenance":[{"kind":"observed","ref":"https://api.github.com/repos/acme/api/pulls/421","source":"github_api"}]},"opened_at":"2026-08-01T12:00:00Z","provenance":[{"kind":"observed","ref":"https://api.github.com/repos/acme/api/pulls/421","source":"github_api"}],"repository":"acme/api","reviews":[{"actor_id":"github:bob","agent":null,"at":"2026-08-02T12:00:00Z","commit_sha":"head","id":"1","provenance":[{"kind":"observed","ref":"https://api.github.com/repos/acme/api/pulls/421/reviews/1","source":"github_api"}],"state":"approved"}],"reviews_complete":true,"title":"Example change","url":"https://github.com/acme/api/pull/421"}],"repository":"acme/api","version":"0.2","window":{"complete":true,"from":"2026-08-01T00:00:00Z","reason":null,"to":"2026-08-31T23:59:59Z"}},"findings":[],"generated":{"source_digest":"sha256:9d0d3f348a59f4cc685b83b369b0a0ee520397ea18faee9bd52178b05eed72dc","tool":"agent-change-control","version":"0.7.0"},"policy":{"agent_review":{"labels":[],"minimum_evidence":"signed","require":["operator","provider","identity"],"satisfies_independence":false},"checks":{"from_forge":true,"required":[]},"fail_on":"medium","minimum_authorship_evidence":"derived","minimum_review_evidence":"observed","rules":{"agent_approval_not_independent":{"enabled":true,"severity":"high"},"agent_approval_recorded":{"enabled":true,"severity":"info"},"agent_approval_unsigned":{"enabled":true,"severity":"warning"},"agent_change_without_independent_human":{"enabled":true,"severity":"high"},"approver_is_author":{"enabled":true,"severity":"high"},"deployed_without_passing_change":{"enabled":false,"severity":"high"},"merged_with_protection_bypass":{"enabled":false,"severity":"high"},"merged_without_independent_approval":{"enabled":true,"severity":"high"},"merged_without_required_checks":{"enabled":false,"severity":"high"},"missing_required_reviewer_team":{"enabled":true,"severity":"high"},"same_vendor_write_and_review":{"enabled":true,"severity":"high"},"unaccounted_branch_update":{"enabled":false,"severity":"high"},"unknown_agent_operator":{"enabled":true,"severity":"warning"}},"version":"0.4"},"summary":{"agent_authored":1,"agent_operator_unknown":0,"changes":1,"clean":1,"findings":0,"human_authored":0,"indeterminate":0,"with_findings":0},"version":"0.4"},"predicateType":"https://noru.tech/spec/ai-change-provenance/v0.4","subject":[{"digest":{"gitCommit":"head"},"name":"github:acme/api:pr:421"},{"digest":{"gitCommit":"merge"},"name":"github:acme/api:pr:421:merge"}]}